{
  "$schema": "https://json-schema.org/draft/2020-12/schema",
  "$id": "urn:evm-audit-skills:domain:v4",
  "type": "object",
  "required": ["id", "name", "checklist_title", "description", "surface_features", "related_domains", "always_screen", "screening_terms", "required_context", "review_requirements", "trusted_absence_policy"],
  "properties": {
    "id": {"type": "string", "pattern": "^evm-audit-[a-z0-9-]+$"},
    "name": {"type": "string", "minLength": 1},
    "checklist_title": {"type": "string", "minLength": 1},
    "description": {"type": "string", "minLength": 1},
    "surface_features": {"type": "array", "minItems": 1, "uniqueItems": true, "items": {"type": "string"}},
    "related_domains": {"type": "array", "uniqueItems": true, "items": {"type": "string", "pattern": "^evm-audit-[a-z0-9-]+$"}},
    "always_screen": {"type": "boolean"},
    "screening_terms": {"type": "array", "minItems": 1, "uniqueItems": true, "items": {"type": "string", "minLength": 1}},
    "required_context": {
      "type": "array",
      "minItems": 1,
      "items": {
        "type": "object",
        "additionalProperties": false,
        "required": ["key", "required", "description"],
        "properties": {
          "key": {"type": "string", "pattern": "^[a-z][a-z0-9_]*$"},
          "required": {"type": "boolean"},
          "description": {"type": "string", "minLength": 1}
        }
      }
    },
    "review_requirements": {"type": "array", "minItems": 1, "uniqueItems": true, "items": {"type": "string", "minLength": 1}},
    "trusted_absence_policy": {
      "type": "object",
      "additionalProperties": false,
      "required": ["requires_complete_scope", "allowed_evidence"],
      "properties": {
        "requires_complete_scope": {"const": true},
        "allowed_evidence": {
          "type": "array",
          "minItems": 1,
          "uniqueItems": true,
          "items": {"enum": ["scope", "inheritance", "interface", "dependency", "deployment"]}
        }
      }
    }
  },
  "additionalProperties": false
}
