{
  "id": "evm-audit-erc4337",
  "name": "ERC4337 Account Abstraction Security",
  "checklist_title": "ERC4337 Account Abstraction Security Checklist",
  "description": "Security review for ERC4337 wallets, paymasters, bundlers, and account-abstraction infrastructure.",
  "surface_features": [
    "uses-erc4337"
  ],
  "related_domains": [
    "evm-audit-signatures",
    "evm-audit-access-control"
  ],
  "always_screen": false,
  "required_context": [
    {
      "key": "entrypoint_version_account_modules_paymasters_and_bundler_assump",
      "required": true,
      "description": "EntryPoint version, account modules, paymasters, and bundler assumptions"
    }
  ],
  "review_requirements": [
    "trace validation, replay, prefund, and execution boundaries"
  ],
  "trusted_absence_policy": {"requires_complete_scope": true, "allowed_evidence": ["scope", "inheritance", "interface", "dependency", "deployment"]},
  "screening_terms": [
    "UserOperation",
    "EntryPoint",
    "paymaster",
    "bundler",
    "account abstraction"
  ]
}
