{
  "id": "evm-audit-defi-amm",
  "name": "AMM and DEX Security",
  "checklist_title": "AMM & DEX Security Checklist",
  "description": "Security review for AMMs, DEXs, swap routers, liquidity pools, and hooks.",
  "surface_features": [
    "uses-amm"
  ],
  "related_domains": [
    "evm-audit-precision-math",
    "evm-audit-erc20",
    "evm-audit-oracles"
  ],
  "always_screen": false,
  "required_context": [
    {
      "key": "pool_model_fee_tier_liquidity_hooks_and_price_source",
      "required": true,
      "description": "pool model, fee tier, liquidity, hooks, and price source"
    }
  ],
  "review_requirements": [
    "model price impact, slippage, callback, and accounting invariants"
  ],
  "trusted_absence_policy": {"requires_complete_scope": true, "allowed_evidence": ["scope", "inheritance", "interface", "dependency", "deployment"]},
  "screening_terms": [
    "swap",
    "pool",
    "liquidity",
    "reserve",
    "hook",
    "slippage"
  ]
}
