{
  "id": "evm-audit-access-control",
  "name": "Access-Control Security",
  "checklist_title": "Access Control Security Checklist",
  "description": "Security review for ownership, roles, authorization, governance, and privileged operations.",
  "surface_features": [
    "uses-access-control"
  ],
  "related_domains": [
    "evm-audit-general"
  ],
  "always_screen": false,
  "required_context": [
    {
      "key": "privileged_roles_and_administrators",
      "required": true,
      "description": "privileged roles and administrators"
    }
  ],
  "review_requirements": [
    "trace every privilege grant, revoke, and transfer path"
  ],
  "trusted_absence_policy": {"requires_complete_scope": true, "allowed_evidence": ["scope", "inheritance", "interface", "dependency", "deployment"]},
  "screening_terms": [
    "owner",
    "role",
    "admin",
    "authorization",
    "governance"
  ]
}
