{
  "id": "evm-audit-signatures",
  "name": "Signature Security",
  "checklist_title": "Signature Security Checklist",
  "description": "Security review for signatures, permits, EIP-712, and meta-transactions.",
  "surface_features": [
    "uses-signature"
  ],
  "related_domains": [
    "evm-audit-access-control",
    "evm-audit-chain-specific"
  ],
  "always_screen": false,
  "required_context": [
    {
      "key": "signed_payload_domain_separator_nonce_signer_and_chain_binding",
      "required": true,
      "description": "signed payload, domain separator, nonce, signer, and chain binding"
    }
  ],
  "review_requirements": [
    "test replay, malleability, expiry, and signer ambiguity"
  ],
  "trusted_absence_policy": {"requires_complete_scope": true, "allowed_evidence": ["scope", "inheritance", "interface", "dependency", "deployment"]},
  "screening_terms": [
    "signature",
    "permit",
    "EIP-712",
    "nonce",
    "replay",
    "ecrecover"
  ]
}
