{
  "id": "evm-audit-defi-staking",
  "name": "Staking and Restaking Security",
  "checklist_title": "Staking & LSD Security Checklist",
  "description": "Security review for staking, liquid staking, restaking, rewards, and yield aggregation.",
  "surface_features": [
    "uses-staking"
  ],
  "related_domains": [
    "evm-audit-precision-math",
    "evm-audit-erc20"
  ],
  "always_screen": false,
  "required_context": [
    {
      "key": "reward_accounting_withdrawal_queue_validator_and_slashing_assump",
      "required": true,
      "description": "reward accounting, withdrawal queue, validator and slashing assumptions"
    }
  ],
  "review_requirements": [
    "model share/reward accounting and delayed exits"
  ],
  "trusted_absence_policy": {"requires_complete_scope": true, "allowed_evidence": ["scope", "inheritance", "interface", "dependency", "deployment"]},
  "screening_terms": [
    "stake",
    "unstake",
    "reward",
    "validator",
    "slashing",
    "restaking"
  ]
}
