{
  "id": "evm-audit-governance",
  "name": "Governance and DAO Security",
  "checklist_title": "Governance & DAO Security Checklist",
  "description": "Security review for governance, voting, proposals, timelocks, and treasury control.",
  "surface_features": [
    "uses-governance"
  ],
  "related_domains": [
    "evm-audit-access-control",
    "evm-audit-flashloans"
  ],
  "always_screen": false,
  "required_context": [
    {
      "key": "voting_power_quorum_timelock_proposal_and_execution_model",
      "required": true,
      "description": "voting power, quorum, timelock, proposal, and execution model"
    }
  ],
  "review_requirements": [
    "trace proposal creation through execution and cancellation"
  ],
  "trusted_absence_policy": {"requires_complete_scope": true, "allowed_evidence": ["scope", "inheritance", "interface", "dependency", "deployment"]},
  "screening_terms": [
    "proposal",
    "vote",
    "quorum",
    "timelock",
    "delegate"
  ]
}
